userID,url,comment,articleID,categoryID
1004770025,https://vnexpress.net/thi-the-cu-ba-trong-bao-tai-4188124.html,Bà sống cùng con cháu. 9 hôm trước bà đi ra khỏi nhà. Thì thể đã đang phân hủy. 1 cụ bà 79 tuổi mất tích 9 ngày thi thể cách 100m mà gia đinh ko hay biết. Chẳng lẽ suốt 9 ngày bà cụ mất tích họ ko tìm sao?,4188124,1001007
1004770025,/hieu-suat-dut-diem-cua-messi-te-nhat-chau-au-4187812.html,Mới mấy hôm trước họ bảo Messi đá như lên đồng...,4187812,1002582
1004770025,/klopp-khong-doi-nao-ngan-duoc-salah-mane-jota-4186587.html,Phải Messi ghi đc 82 bạn mới vui à. Người ta nói trận tối nay chứ nội trận nào cũng thế đâu. Nếu như liv đá như trận tối nay mà klop đáng nói gặp bacca thì cũng 82 chứ không phải 40 đâu.,4186587,1002575
1004770025,/koeman-lam-viec-cung-messi-khong-kho-4186554.html,Vòng bảng thôi mà .đi thì ghi nhiều bàn nhất vòng bảng.có gì đáng tự hào ở đây.,4186554,1002582
1004770025,/koeman-lam-viec-cung-messi-khong-kho-4186554.html,Không hẳn nhé bạn. Nếu như bạn đi học lớp 1 mà lưu ban quá nhiều năm bạn cũng sẽ có quyền lực như Messi vậy?,4186554,1002582
1004770025,/barca-thoat-thua-alaves-4185186.html,Lên đồng....,4185186,1002582
1004770025,/tuong-lai-nao-cho-barca-hau-ky-nguyen-bartomeu-4184104.html,Với sự ủng hộ đông đảo của CĐV ở Việt Nam cho Messi tôi nghĩ Bacca nên bầu Messi làm luôn chủ tịch.,4184104,1002582
1004770025,/messi-choi-nhu-len-dong-sau-khi-chu-tich-barca-tu-chuc-4184503.html,Công việc thì liên quan gì đến thánh nhân và đạo đức gì ở đây.bạn là cầu thủ chuyên nghiệp bạn được trả lương hậu hĩnh vậy mà bạn lại làm việc nửa vời. Như vậy khi nhận đồng tiền mang về nhà bạn có tự xấu hổ không? Nhưng tiền mới chỉ là 1 phạm phù thôi. Bạn ko làm việc hết mình ko mang lại thành tích tập thể thì nó còn ảnh hưởng đến đồng đội và các fan trung thành của bacca.,4184503,1002575
1004770025,/hang-thu-liverpool-tan-hoang-4183165.html,Thao lược thì cũng cần thiên thời địa lợi mới được. Nói như bạn thao lược giỏi sang Việt Nam dẫn dắt thì tuyển việt nam được dự wc sao?,4183165,1002575
1004770025,/liverpool-thang-nguoc-o-ngoai-hang-anh-4181748.html,Không có van dijk đội hình xem thiếu tự tin hẳn.,4181748,1002580
1004770025,/koeman-var-chi-quyet-dinh-bat-loi-cho-barca-4181740.html,Đúng vậy ông ơi. Real thắng nhờ trọng tài nhờ không có cr7 nên real thắng. Còn Messi tự làm tự ăn không cần trọng tài đâu ạ. Những trận thua kiểu như 82 hay 31 cũng không khác nhau chứ 21 với 31 thì cũng như nhau.,4181740,1002582
1004770025,/fati-lap-ky-luc-khi-barca-thua-real-4181726.html,"Chẳng hiểu sao luôn. Vẫn Messi ở đó, vẫn cầu thủ xuất sắc nhất mọi thời đại với 6 quả bóng vàng, vẫn là Messi tự làm tự ăn, mà nhưng trận thua 82 31 vẫn cứ xảy đến là sao? Toàn những trận quan trọng. Đấy là còn chưa nói đến mấy giải Aff cúp. Aff cúp còn chưa xong. Mà cho cầu thủ này đá euro như cr7 thì không biết có cúp không?",4181726,1002582
1003625169,https://vnexpress.net/tau-hang-chim-tren-bien-4188304.html,Đau thương nối tiếp những đau thương ! Mong sớm cứu được vị thuyền trưởng,4188304,1001005
1003625169,https://vnexpress.net/6-nguoi-viet-tu-vong-trong-vu-tai-nan-oto-o-campuchia-4188066.html,Nam mô a di đà phật ! Vì cuộc sống phải bỏ mạng ở nơi xứ người,4188066,1003459
1003625169,/5-goc-chup-nhu-han-quoc-o-ha-noi-4182964.html,Lại được khám phá một không gian sống ảo giữa lòng Hà Nội,4182964,1004636
1003625169,https://vnexpress.net/nghi-can-giet-nguoi-phu-nu-khai-bi-chu-no-doa-chat-tay-4184519.html,Nạn nhân quá chủ quan và tin người . Đây là bài học cảnh tỉnh những người lớn tuổi ở nhà một mình cho người lạ mặt vào nhà,4184519,1001007
1003625169,https://vnexpress.net/9-nam-long-hanh-cua-ba-trum-the-gioi-ngam-4184217.html,Mafia Trung Quốc nổi tiếng máu lạnh trên toàn thế giới,4184217,1003426
1003625169,/ong-cao-thang-khoc-khi-vo-dau-de-4184371.html,Mẹ tròn con vuông! Ông Cao Thắng là người chồng người cha rất có trách nhiệm với vợ con,4184371,1002726
1003625169,https://vnexpress.net/sat-lo-dat-tai-huyen-phuoc-son-quang-nam-4183970.html,Chưa có năm nào thiên tai bão lũ đổ dồn về miền trung như vầy. Cầu mong cho người dân các tỉnh miền trung sớm vượt qua,4183970,1001005
1003625169,https://vnexpress.net/dien-bien-vu-sat-lo-dat-o-nam-tra-my-4183763-tong-thuat.html,Cầu mong mọi người sớm siêu thoát,4183763,1001005
1003625169,/co-gai-ha-noi-theo-chong-tay-ve-doi-nui-lam-nong-4183065.html,Chỉ có tình yêu đích thực mới giúp cô gái Hà Nội thích nghi cùng cuộc sống trang trại ở xứ trời tây,4183065,1003819
1003625169,/hlv-sai-gon-truong-doan-bong-da-hagl-noi-bay-4181957.html,Hành động của thủ môn HAGL khi phản ứng trọng tài cũng cần có chế tài xử phạt. Thủ môn có phản ứng phi thể thao đối với người cầm còi khi quyết định thổi phạt pelanty,4181957,1002568
1003625169,/tai-tu-ly-huynh-trong-ky-uc-nguoi-o-lai-4180402.html,Bác Lý Huỳnh còn sống mãi với nền điện ảnh Nước nhà,4180402,1002726
1003625169,/nghe-si-ly-huynh-qua-doi-4180363.html,Bác ra đi thanh thản! Nền điện ảnh Việt Nam giữ mãi hình ảnh của bác Lý Huỳnh,4180363,1002726
1003625169,https://vnexpress.net/102-nguoi-chet-160-000-nha-ngap-do-mua-lu-4179085.html,Miền Trung cố lên ! Cả nước đang hướng về khúc ruột Miền Trung,4179085,1001005
1003625169,https://vnexpress.net/pho-tu-lenh-quan-khu-4-cung-12-nguoi-gap-nan-khi-di-cuu-ho-4175885.html,Cầu mong cho mọi người bình an may mắn ! Nam mô a di đà Phật,4175885,1001005
1003625169,https://vnexpress.net/hon-100-nguoi-tim-kiem-nhom-cong-nhan-thuy-dien-4175454.html,Cầu mong cho mọi người tai qua nạn khỏi. Hạn chế thương vong đến mức thấp nhất,4175454,1001005
1003625169,/nghe-si-tuan-phuong-qua-doi-4171496.html,Thật thương xót cho một nghệ sĩ ra đi khi đang ở đỉnh cao sự nghiệp,4171496,1002726
1003625169,/quay-rau-cua-co-gai-viet-trong-cho-phien-australia-4171581.html,Rất tự hào về bạn !,4171581,1003463
1003625169,https://vnexpress.net/co-gai-bi-ham-hai-vi-sap-bay-lua-thue-phong-4170805.html,Em gái này chắc ít theo dõi tin tức an ninh trật tự rồi,4170805,1001007
1003625169,https://vnexpress.net/canh-sat-my-no-sung-cuu-dong-nghiep-4171020.html,Tên này chắc bị ngáo mới cầm dao tấn công cảnh sát Mỹ,4171020,1001007
1003625169,https://vnexpress.net/cao-toc-hon-6-300-ty-dong-sap-thong-tuyen-4168564.html,Đoạn cao tốc từ cầu Cao Lãnh đến cầu Vàm cống xuất hiện những ổ gà và có những vị trí lún cục bộ trên làn xe ô tô,4168564,1003459
1032023115,/hlv-sai-gon-chung-toi-da-vi-bong-da-sach-khong-lien-quan-bau-hien-4188316.html,"Tôi là fan Thể Công, giờ thích Viettel nhưng Viettel muốn tự quyết thì phải quyết thắng trận cuối. Tôi tin các cầu thủ Viettel sẽ cố gắng làm được, giành chiến thắng vẻ vang. Nếu Viettel không thắng thì họ chưa xứng đáng vô địch mùa này và tôi sẵn sàng chúc mừng Hà Nội nếu họ thắng Quảng Ninh dù trong lòng không vui. Viettel, Hà Nội hay Sài Gòn mùa này vô địch đều xứng đáng vì họ là những đội mạnh nhất.<br/><br/>Chúc Viettel chiến thắng giành ngôi vương!",4188316,1002568
1032023115,/hlv-sai-gon-chung-toi-da-vi-bong-da-sach-khong-lien-quan-bau-hien-4188316.html,"Phát biểu của ông rất hay, thể thao đỉnh cao là phải máu lửa, hết mình tới trận cuối cùng dù gặp đối thủ nào, kể cả không còn mục tiêu chứ không phải ""đá cho vui"" với thái độ hời hợt. Các đội khác mà đá quyết chiến thế này, thắng tự hào, thua nhận thua không đổi tại, bị thì giải đấu VL chắc chắn sẽ ngày càng chất lượng. Cảm ơn ông!",4188316,1002568
1032023115,https://vnexpress.net/tp-hcm-se-lap-he-thong-dien-mat-troi-tai-tru-so-cong-4188296.html,"Rất hợp lý, các cơ sở công nên đi đầu trong chiến lược dùng năng lượng sạch để nâng cao hiệu quả và giảm gánh nặng cho ngành điện lực, điện các nhà máy dư ra thì để dùng cho hoạt động sản xuất, kinh doanh nhằm phát triển kinh tế xã hội. Miền nam có bản đồ nhiệt cao gần như quanh năm, các nước khác muốn cũng không được trong khi đó chiến lược sử dụng năng lượng mặt trời của chúng ta có vẻ hơi chậm so với tiềm năng và nhu cầu của nền kinh tế.",4188296,1001005
1032023115,/hagl-thua-tran-thu-sau-lien-tiep-4186509.html,"Giàn cầu thủ của HAGL mà trẻ, đang độ chín sự nghiệp gặp giàn cầu thủ trẻ. mới trẻ hóa đá VL của Bình Dương sinh năm 1997 - 1998 đá còn không chịu nổi. Các cầu thủ trẻ của Bình Dương chẳng danh tiếng mà đè ngửa đàn anh siêu sao ra đá 3 quả trong 1 hiệp mà fan vẫn bảo là sao. Giàn cầu thủ này gặp đội khác cho dự bị ngay, không lớn được vẫn bị bốc lên mây xanh, bó tay!",4186509,1002568
1032023115,/hlv-vu-tien-thanh-ban-thang-cua-quang-hai-khien-sai-gon-sup-do-4187090.html,"Quả vô lê của Quang Hải là bàn thắng đẳng cấp, ít cầu thủ làm được trong phút ngẫu hứng. Kỹ thuật và đẳng cấp của các tiền vệ là ở những khoảng khắc đặc biệt như thế này.",4187090,1002568
1032023115,/hagl-thua-tran-thu-sau-lien-tiep-4186509.html,"Tây HAGL đá hay, dũng mãnh, gánh team cả mùa. Hàng tiền vệ HAGL thuộc hàng yếu của VL nên sức ép lên hàng thủ rất lớn. Lối đá nhìn tưởng hay nhưng thực sự không hiệu quả và khoảng trống mênh mông ở tiền vệ, hàng tiền vệ có Xuân Trường thì càng thua nặng vì cầu thủ này cầm bóng và tranh chấp là con số 0, đá như chấp người. Có Minh Vương còn đỡ. Dù đá 3 tây, tây khá chất nhưng HAGL vẫn thua là do chất lượng cầu thủ nội. Năm sau đội nào vớ được ông Chevy Walsh là cầu thủ hàng đầu của VL, ra khỏi HAGL đến Viettel hay HN sẽ có chức vô địch.",4186509,1002568
1032023115,https://vnexpress.net/vi-sao-bo-quy-dinh-duoi-hoc-4160003.html,"Bạn là thầy cô ở trường, bạn xử lý như thế nào với các em chuyên trấn lột, tạo băng nhóm, đánh đập các bạn khác trong trường, sau nhiều lần cảnh cáo các em này không sợ bị đuổi học vẫn tiếp diễn hành vi bạo lực, thậm chí có những em học cấp 3 đã phạm tội ngoài xã hội, thậm chí đánh cả Thầy/Cô. Những em này nên được giáo dục riêng, với phương pháp đặc biệt tại trường khác thì mới có hy vòng thành người, tốt cho các bạn khác. Tôi đã từng xem một số bộ phim của Mỹ về giáo dục thiếu niên hư, một trong số đó do Dwayne Jonhson đóng vai thầy giáo dạy thể thao đã cảm hóa được các em trong trường dành cho trẻ em cá biệt, về sau nhiều em đã thành công trở thành các ngôi sao bóng rổ, thành người tốt.",4160003,1003497
1032023115,https://vnexpress.net/vi-sao-bo-quy-dinh-duoi-hoc-4160003.html,"Trong xã hội có nhiều em không thể cho phép học cùng các em khác vì có thể gây mất an ninh, tạo động cơ xấu cho các bạn khác và cho trường. Ở một số nước, do bảo vệ quyền trẻ em không cho phép các trường đuổi học các học sinh vi phạm nghiêm trọng, nhưng họ có thành lập các cơ sở đào tạo riêng dành cho các em này, khi trường thấy không tiếp tục đào tạo được, trường không đuổi nhưng cho các em về trường đào tạo dành cho thanh, thiếu niên hư. Mình không có trường kiểu đó nên cũng khó cho các Thầy/Cô khi gặp các học sinh cấp 3 cá biệt, thậm chí có hành vi bạo lực, hành vi chống đối tiêu cực.",4160003,1003497
1032023115,https://vnexpress.net/hlv-indonesia-thieu-cong-phuong-xuan-truong-la-mat-mat-lon-cho-viet-nam-3897891.html,Không có CP. XT. VT. TA thắng U23 Thái Lan 4-0. Có bộ tứ HAGL thua Thái 0-3. Rõ rồi nhé.,3897891,1002568
1032023115,https://vnexpress.net/hagl-va-su-lac-loi-o-v-league-3906308.html,"Bạn nhầm khi nói lương cầu thủ VL thấp như thế, cả lương, cả thưởng với cầu thủ hàng đầu VL như Quang Hải phải tầm 70 triệu, chưa kể khoản quảng cáo gấp nhiều lần lương ở nước ngoài. Ngoài ra khi họ chuyển nhượng có thể đút túi cả 10 tỷ, dạng như Công Vinh, Thành Lương, Quế Hải, sau này Văn Hậu, Đình Trọng, Quang Hải chuyển nhượng cực cao, lương không so được đâu. Cầu thủ HAGL bị xích đến năm 28 tuổi mãi vẫn là cầu thủ nghèo so với phần còn lại ở VL đấy bạn ạ.",3906308,1002568
1032023115,https://vnexpress.net/djokovic-muon-vuot-federer-ve-so-grand-slam-3874660.html,"Có thể quá đi chứ, ông già FX bị Nadal khắc tinh mà còn dành 3 GL trong 2 năm vừa qua trong khi đó lối đánh của Djonkovic di chuyển ít, đều 2 tay có thể nói là hoàn thiện nhất trong 3 người.",3874660,1002619
1032023115,https://vnexpress.net/djokovic-muon-vuot-federer-ve-so-grand-slam-3874660.html,"Với phong độ hiện nay thì việc vượt Nadal và RF là không phải không có cơ sở. Nole có quyết tâm và kỹ năng của của con sói, tôi tin Anh ta làm được. Chúc Nole tạo ra kỳ tích mới.",3874660,1002619
1032023115,https://vnexpress.net/djokovic-nadal-la-doi-thu-lon-nhat-cua-toi-3874162.html,"Sau trận AO này, số trân thắng ở chung kết GS là ngang nhau, mỗi tay vợt thắng 4 trận. Nhưng kết quả chung cuộc đối đầu Djonkovic đang dẫn cách biệt 3 trận.",3874162,1002619
1032023115,https://vnexpress.net/djokovic-vo-dich-australia-mo-rong-2019-3874591.html,"Chúc mừng Djonkovic, ông vua của Australia Open. Chỉ kém 2 cup nữa là bắt kịp Nadal, sau đó dần đuổi Federer. Với phong độ vô đối hiện nay thì khả năng bắt kịp 2 tay vợt hàng đầu hiện nay khá khả thi.",3874591,1002619
1032023115,http://vnexpress.net/tin-tuc/giao-duc/hoa-binh-lang-son-co-nhieu-thu-khoa-truong-quan-doi-3789458.html,"Đầu ra mà thi cử thì càng có tiêu cực. Tốt nhất thi nghiêm như kỳ thi đại học cũ. Nếu thi tại tỉnh thì giảng viên các trường ĐH lớn chủ trì các điểm thi, tỉnh chỉ phụ trợ, các trường đại học địa phương không được coi thi ở Tỉnh mình và trong mỗi phòng thi Cán bộ coi thi 1 và giám sát hành lang là các thầy/cô trường đại học tỉnh khác.",3789458,1003497
1032023115,http://vnexpress.net/tin-tuc/giao-duc/hoa-binh-lang-son-co-nhieu-thu-khoa-truong-quan-doi-3789458.html,"Học Bách khoa, Xây dựng thì bị đuổi sớm à bạn, học mấy trường đấy điểm không thực chất thì không thọ nổi 2 năm đầu đâu. Học mấy trường dễ như An Ninh, Quân đội thì lọt được nhưng học Quân Y thì cũng không qua nổi.",3789458,1003497
1032023115,http://vnexpress.net/tin-tuc/giao-duc/giao-vien-de-nghi-bo-thi-trac-nghiem-mon-lich-su-3784662.html,Vì con bạn chơi trò chơi điện tử có các nhân vật của Tam Quốc.,3784662,1003497
1032023115,http://thethao.vnexpress.net/tong-thuat/ha-noi-dai-thang-quang-ninh-bat-bai-sau-luot-di-v-league-3763219.html,"Chất lượng trận đấu rất cao, xem 2 đội thi đấu trên sân quá mãn nhãn, CĐV Quảng Ninh dù bị thua nhưng vẫn hài lòng với màn trình diễn của các cầu thủ Quảng Ninh.",3763219,1003001
1032023115,http://thethao.vnexpress.net/tong-thuat/noi-binh-ruc-sang-ha-noi-dat-chuoi-11-tran-bat-bai-3758318.html,"Hà Nội số 1 VL, đỉnh bảng với 11 trận bất bại trong đó 9 trận thắng và có trận thắng 5-0. Đá hay, đá đẹp nhất là đương nhiên, hôm nay thắng Khánh Hòa càng làm nổi bật chiến công của những đứa con Thủ đô. Cảm ơn các bạn!",3758318,1003001
1032023115,http://thethao.vnexpress.net/tin-tuc/tin-tuc/khung-hoang-nhan-su-de-doa-ky-luc-bat-bai-cua-ha-noi-o-v-league-3758258.html,"Hà Nội nhiều cầu thủ gốc địa phương nhất VL nhé, HAGL còn ít người Gia Lai hơn Hà Nội. Không biết, GATO đừng phát biểu dài. Hiện Hà Nội là CLB hay nhất VL, hôm nay không có Oseni vẫn thắng Khánh Hòa 4-0, ghi bàn toàn nội binh.",3758258,1004190
1043760530,https://vnexpress.net/tp-hcm-se-lap-he-thong-dien-mat-troi-tai-tru-so-cong-4188296.html,"Sau này phần lớn vật liệu năng lượng này bỏ đi thì xử lý rác thải thế nào? Các nhà môi trường, sản xuất, cung ứng.... có tính đến việc này không?",4188296,1001005
1050123547,https://vnexpress.net/tp-hcm-se-lap-he-thong-dien-mat-troi-tai-tru-so-cong-4188296.html,"Chủ trương rất đúng, cần nhân rộng ngay ra tất cả các tỉnh thành",4188296,1001005
1050123547,https://vnexpress.net/50-canh-sat-ruot-duoi-oto-cho-lo-ma-tuy-hang-chuc-ty-dong-4157712.html,"Hoan hô các đc công an, cần thiết phải mạnh tay hơn nữa, có thể tiêu diệt ngay những tay có vũ khí để an toàn cho người vô tội",4157712,1003426
1050123547,https://vnexpress.net/cum-cong-nghiep-xay-trai-phep-4131026.html,Chuyện này có thật sao????.,4131026,1001005
1050123547,https://vnexpress.net/hoc-sinh-sai-gon-tuu-truong-ngay-1-9-4120131.html,"10 năm gần đây nhập học 15/8 là để khi nước lũ về các em có thể nghỉ tránh lũ, nay kiếm lũ không ra nhưng vẫn giữ như cũ chỉ vì . . . Quên.",4120131,1003497
1050123547,https://vnexpress.net/thu-nghiem-buoc-dau-thanh-cong-vaccine-covid-19-viet-nam-4095422.html,Tin mừng cho đất nước Việt Nam và cho cả thế giới. Tuyệt vời lắm Việt Nam ơi!,4095422,1003784
1050123547,https://vnexpress.net/bo-quy-dinh-hoc-sinh-deo-khau-trang-trong-lop-4095657.html,Hoan nghênh một quyết định kịp thời. Đây là thời điểm an toàn nhất ở Việt Nam. Các quy định khắt khe hơn nếu có chỉ áp dụng khi đất nước mở cửa với người nước ngoài.,4095657,1003497
1050123547,https://vnexpress.net/tien-giang-xin-lam-ho-nuoc-ngot-400-ty-dong-4088636.html,"Việc ngăn sông làm hồ cần phải xem xét kỹ các khía cạnh:<br/>1. Giao thông đường thủy sẽ ra sao<br/>2. Trữ lượng nước dự kiến sẽ là bao nhiêu, ngoài cung cấp nước cho SX nông nghiệp thì có sử dụng cho nhà máy nước BOO hay không?<br/>3. Bên trong nội đồng có cần thêm hệ thống các hồ chứa nước nhỏ không?<br/>4. Nguồn nước thải có đổ trực tiếp ra hồ này không? Nhất là Kcn Long Giang.<br/>Đề nghị xem xét kỹ, nếu có biện pháp tốt thì xây hồ mới có hiệu quả",4088636,1001005
1050123547,https://vnexpress.net/them-5-dia-phuong-cho-hoc-sinh-tro-lai-truong-4088192.html,"Cho đi học lúc này là rất an toàn, dịch đã được kiểm soát hoàn toàn. Tình hình sẽ phức tạp lên khi nước ta bắt đầu mở cửa đón kiều bào, du học sinh về và tiếp đón khách quốc tếtế",4088192,1003497
1050123547,https://vnexpress.net/dieu-hanh-xuat-khau-gao-giat-cuc-lam-kho-doanh-nghiep-4086687.html,"Chỉ ít ngày nữa giá gạo tuột dốc rồi mới cho xuất, . . . Cuối cùng nông dân lãnh đủ.",4086687,1003184
1050123547,https://vnexpress.net/nhung-bat-thuong-sau-khi-noi-lai-xuat-khau-gao-4084791.html,"Mục đích của việc tạm dừng xuất khẩu gạo là để ưu tiên dự trữ, nhưng các DN trúng thầu gạo dự trữ lại không giao hàng. Như vậy không chỉ đơn thuần là vi phạm luật đấu thầu mà là 1 hành vi vô cùng nguy hiểm ảnh hưởng đến an ninh lương thực quốc gia.&nbsp;",4084791,1003165
1050123547,https://vnexpress.net/vay-bat-dua-xe-mot-canh-sat-co-dong-phai-cua-chan-4083500.html,"Ủng hộ ý kiến của bạn, phải phạt roi, phạt tù bọn này mới sợ.",4083500,1001007
1050123547,https://vnexpress.net/trump-cam-on-viet-nam-4081854.html,Đây chính là bản lĩnh Việt Nam,4081854,1001002
1002965337,https://vnexpress.net/phu-nhan-biden-se-tiep-tuc-lam-cong-an-luong-4188579.html,Chúc bà giáo - đệ nhất phu nhân nhiều sức khỏe.,4188579,1001002
1002965337,https://vnexpress.net/suc-anh-huong-cua-trump-sau-khi-roi-nha-trang-4188137.html,Nghe 28 năm xa chứ thật ra cách có 3 đời tổng thống chứ mấy.,4188137,1001142
1002965337,https://vnexpress.net/de-xuat-dung-dien-thoai-thay-ve-di-metro-4188161.html,Ở bến xe mà mất điện thoại là bình thường.,4188161,1003459
1002965337,https://vnexpress.net/tp-hcm-se-lap-he-thong-dien-mat-troi-tai-tru-so-cong-4188296.html,"Tận dụng vậy rất tốt, sẵn chỗ đèn đỏ làm máy che bằng pin năng lượng luôn, vừa mát vừa bán được tiền điện.",4188296,1001005
1002965337,https://vnexpress.net/yeu-cau-nguoi-dung-mang-xa-hoi-xac-dinh-danh-tinh-4187898-tong-thuat.html,"Tài khoản game ta chơi chán ,ta tạo cái mới,thì MXH cũng vậy.",4187898,1004678
1002965337,https://vnexpress.net/yeu-cau-nguoi-dung-mang-xa-hoi-xac-dinh-danh-tinh-4187898-tong-thuat.html,"Người lớn trong nhà mình mấy tháng tạo một cái kìa , vì họ tạo xong không nhớ mật khẩu. Mai mốt mất tài khoản phải ra công an phường chứng à?",4187898,1004678
1002965337,https://vnexpress.net/yeu-cau-nguoi-dung-mang-xa-hoi-xac-dinh-danh-tinh-4187898-tong-thuat.html,Ai bán sim rác cho đại lý.,4187898,1004678
1002965337,/tin-tuc/nhip-song/cua-hang-hut-khach-nho-banh-mi-yeu-nuoc-4176718.html,Sáng tạo nè!,4176718,1004075
1002965337,/gia-giong-nam-de-lua-tinh-ban-than-4186218.html,"Khi 2 người call video với nhau , bạn trai hỏi bạn gái thích món quà này không ? Bạn gái trả lời ""xí, ai mà thèm"" , nếu là người thật thà sẽ tin thật.",4186218,1004260
1002965337,https://vnexpress.net/de-xuat-ket-noi-cao-toc-long-thanh-voi-khu-dong-tp-hcm-4186934.html,"Nên ngày lễ từ Vũng Tàu về HCM đi đường ngoài còn nhanh hơn. Khúc đó mà có xe đạp điện chạy còn nhanh hơn xe hơi. Nghĩ sao chỗ Mai Chí Thọ, lại chung lối vào phà Cát Lái.",4186934,1003459
1050123547,https://vnexpress.net/vi-sao-dai-loan-khong-thieu-khau-trang-4079909.html,Mới thấy 1 người nói thật lòng,4079909,1003185
1050123547,https://vnexpress.net/viet-nam-ho-tro-duc-6-000-ong-lay-mau-benh-pham-4077576.html,Niềm kiêu hãnh Việt Nam!,4077576,1001002
1050123547,https://vnexpress.net/khong-can-tiep-te-do-an-cho-nguoi-trong-khu-cach-ly-4073588.html,Chính xác,4073588,1001005
1050123547,https://vnexpress.net/nguoi-viet-o-tay-ban-nha-cang-minh-vi-covid-19-4070267.html,"Hãy quên yếu tố kinh tế đi, thiệt hại này là cả thế giới phải đang gồng mình chịu chứ không phải riêng ai. Chúng ta cần phải dừng ngay và tất cả các hoạt động cho tới khi hết dịch rồi làm lại sẽ tốt hơn.",4070267,1001158
1050123547,https://vnexpress.net/nam-thanh-nien-o-tp-hcm-nhiem-ncov-4068927.html,"Chính vì quá cảnh nên cần phải khai báo trung thực để được theo dõi, nhưng bà ta đã khai man",4068927,1003784
1050123547,https://vnexpress.net/xay-37-nha-trai-phep-bi-phat-hon-ty-dong-4063908.html,"Buộc phá vỡ, phục hồi nguyên trạng phải thực hiện nghiêm túc không để dây dưa rồi tái phạm. . . rồi lại hợp thức hóa",4063908,1001005
1050123547,https://vnexpress.net/nguoi-nghi-trom-cho-bi-danh-chet-4061229.html,"Luật pháp cần phải có hình phạt nặng hơn, khi đó mới có thể làm giảm sự bức xúc của người dân gây ra những hậu quả đáng tiếc",4061229,1001007
1050123547,https://vnexpress.net/me-chong-sars-con-chong-ncov-4060390.html,Cùng chung cảm xúc như bạn,4060390,1004260
1002965337,/hoc-video-tren-mang-em-be-nuot-kem-cat-mong-tay-vao-bung-4185741.html,"Cũng hợp lý , hồi đó mình đi xem ảo thuật thấy người ta nuối kiếm hên mình không bắt chước , giờ không biết mấy người làm ảo thuật bị bắt hết chưa?",4185741,1003784
1002965337,/lo-trinh-tat-song-dien-thoai-cuc-gach-4185183.html,Vì ngoài 70 và 60 tuổi là hai đốt tuổi khác nhau.,4185183,1003184
