userID,url,comment,articleID,categoryID
1061601392,https://vnexpress.net/viet-cho-nhung-ai-dang-choi-voi-sau-ly-hon-4188398.html,Cảm ơn em người cũ đã nói lại câu này.<br/>Mong cho tôi và những người tin vào tình yêu có thể tìm được hạnh phúc bình dị nhất giữa cuộc đời này.,4188398,1001014
1061601392,https://vnexpress.net/anh-noi-se-bo-vo-de-bu-dap-cho-me-con-toi-4188394.html,Vân ơi.. rồi một mai hắn đến với một người đàn bà khác thì câu hắn sẽ nói lại câu này đấy nhé.,4188394,1001014
1061601392,https://vnexpress.net/giao-vien-chu-dong-thay-ngu-lieu-sach-canh-dieu-4188658.html,"Mỗi lần phát hành bộ sách cho học sinh, thấy cả một ban biên soạn rất hoành tráng. Vậy mà..",4188658,1003497
1006230800,https://vnexpress.net/ha-noi-dong-duc-trong-thoi-diem-cach-ly-xa-hoi-4082313.html,Đi làm công nhân công trình thì có được xem là ra ngoài trong trường hợp cần thiết không,4082313,1001005
1006230800,https://vnexpress.net/bo-y-te-tim-nguoi-tren-28-chuyen-bay-co-ncov-4070280.html,"Tại sao không cách ly 14 ngày toàn bộ người từ nước ngoài đến Việt Nam, công ty tôi sắp phải đóng cửa rồi đây.&nbsp;",4070280,1003784
1006230800,https://vnexpress.net/vo-xin-tha-thu-vi-ngoai-tinh-4060476.html,"Ăn ngoài có 1 cái hay là đã đi ăn 1 lần, sẽ ăn được lần 2.",4060476,1001014
1006230800,https://vnexpress.net/bo-cong-an-de-xuat-bo-so-ho-khau-giay-4057970.html,Hết sức ủng hộ,4057970,1001007
1006230800,https://vnexpress.net/phong-van-truc-tuyen-ve-muc-xu-phat-vi-pham-nong-do-con-moi-4037986.html,Tôi đề nghị nồng độ dưới 0.05 thì không phạt,4037986,1001005
1006230800,https://vnexpress.net/clattenburg-var-nen-ngung-bat-loi-viet-vi-4034877.html,Quyền lực trong tay kẻ mạnh và kẻ mạnh đâu có thích công bằng.,4034877,1002580
1006230800,http://video.vnexpress.net/tin-tuc/nhip-song/dao-co-hon-20-000-con-4013765.html,"Nếu ông nhịn ăn 90 năm, chắc cũng tiết kiệm được nhiều tài nguyên cho đất nước",4013765,1004075
1002733274,https://vnexpress.net/duong-toi-chien-thang-dang-hep-dan-voi-trump-4187079.html,2016 ko lặp lại đâu bác Trăm ơi.,4187079,1001002
1002733274,https://vnexpress.net/bau-cu-tong-thong-my-ngay-4-11-4186567-tong-thuat.html,Chia buồn Trump,4186567,1001002
1002733274,https://vnexpress.net/nguoi-my-dung-thanh-luy-phong-bao-loan-bau-cu-4186228.html,Nước Mỹ mà ghê vậy.. Hahaha,4186228,1001002
1002733274,https://vnexpress.net/dien-bien-ngay-bau-cu-tong-thong-my-4186002-tong-thuat.html,Fan cuồng Trump lo lắng rồi.,4186002,1001002
1002733274,/chau-au-guc-nga-truoc-lan-song-covid-19-thu-hai-4185423.html,Châu Âu đã quá sai lầm khi phòng dịch nửa vời và bây giờ họ đang trả giá đắt....rất rất đắt.&nbsp;,4185423,1003784
1002733274,/ky-thuat-hoi-sinh-nguoi-chet-lam-sang-4184858.html,Khoa học vô biên con người hưởng lợi,4184858,1003784
1002733274,/ibrahimovic-giup-milan-tim-lai-chien-thang-4185390.html,Cae Ibrahi hay Cr7 đều đá ở giải đấu quá tầm thường .,4185390,1002581
1002733274,/nghe-si-anh-hoa-qua-doi-4185328.html,"Ôi thương cô quá. Miền bắc có cô Hoàng Yến, giờ điện ảnh mất thêm gạo cội phúc hậu.",4185328,1002726
1002733274,https://vnexpress.net/bao-goni-khien-4-nguoi-chet-o-philippines-4185301.html,Khủng khiếp thật...mấy đảo tâm bão bên phi đúng là quanh năm làm bao nhiêu cúng cho bão hết.,4185301,1001002
1002733274,https://vnexpress.net/no-sung-ben-ngoai-nha-tho-phap-4185216.html,"Ông bạn người pháp của mih ở Lyon, cả tuần nay ko liên lạc đc lo lắng quá.",4185216,1001002
1002733274,https://vnexpress.net/goni-tro-thanh-bao-manh-nhat-the-gioi-trong-nam-4184852.html,Đang bão lũ đau thương các ông các bà đi so sánh kinh tế.,4184852,1001002
1004414622,https://vnexpress.net/duong-ve-viet-nam-cua-cong-nhan-tung-mac-covid-19-4150462.html,"Thật cảm động. Một dân tộc nghĩa tình, ""không để ai bị bỏ lại phía sau"".",4150462,1001005
1004414622,https://vnexpress.net/dung-danh-mat-nu-cuoi-4146820.html,Giọng ca của cô còn mãi với thời gian. Chúc cô luôn vui khỏe và nhớ về quê hương VN.,4146820,1003450
1004414622,https://vnexpress.net/hai-cha-con-lam-nghe-moc-cong-o-sai-gon-4146783.html,Thương quá,4146783,1001005
1004414622,https://vnexpress.net/putin-tuyen-bo-nga-da-co-vaccine-covid-19-4144887.html,Chúc mừng,4144887,1001002
1004414622,https://vnexpress.net/dieu-ky-dieu-trong-ngoi-nha-co-5-nguoi-tam-than-4142845.html,Trời ơi thương quá. Nỗi đau chiến tranh.,4142845,1003819
1004414622,https://vnexpress.net/duong-day-dua-40-nguoi-trung-quoc-vao-viet-nam-4139049.html,Thật phẫn nộ,4139049,1001007
1004414622,https://vnexpress.net/ong-lao-viet-kieu-nuoi-giac-mo-socola-made-in-vietnam-4135340.html,Hãy mua soocla Kimmy. hãy ủng hộ.,4135340,1004260
1004414622,https://vnexpress.net/cuoc-song-nghet-tho-cua-mot-cong-nhan-mat-viec-4135138.html,Đọc báo mà cứ cay khoé mắt. Mình cũng vất vả nhưng 2 bạn còn khốn khó hơn nhiều.,4135138,1001005
1004414622,https://vnexpress.net/bi-kich-cua-nguoi-2-lan-trung-doc-dac-4126813.html,"Tôi đã thấy ông tại công viên Phú Cường, rất khâm phục.",4126813,1004260
1004414622,https://vnexpress.net/gia-dinh-dong-nghiep-tien-biet-nghe-si-hoang-yen-4127700.html,Vĩnh biệt một nghệ sỹ tài năng,4127700,1002726
1057161163,https://vnexpress.net/quy-trinh-cach-ly-tu-nguyen-tai-khach-san-o-ha-noi-4188145.html,Cầu mong mọi người bình an! Cố lên Việt Nam! Đất nước chiến thắng!,4188145,1001005
1057161163,https://vnexpress.net/bao-atsani-suy-yeu-4188232.html,Nam mô A di đà Phật! Cầu mong mọi người bình an!,4188232,1001005
1057161163,/mot-nguoi-ve-tu-angola-nhiem-ncov-4188152.html,Cầu mong mọi người bình an! Việt Nam cố lên! Đất nước chiến thắng!,4188152,1003784
1057161163,https://vnexpress.net/so-ca-covid-19-o-my-tang-ky-luc-ngay-thu-hai-lien-tiep-4187775.html,Cầu mong thế giới bình an!,4187775,1001002
1057161163,https://vnexpress.net/hang-tram-nha-dan-bi-lu-chia-cat-4187885.html,Nam mô A di đà Phật! Cầu mong mọi người bình an!,4187885,1001005
1057161163,https://vnexpress.net/bao-manh-cap-10-gan-bien-dong-4188067.html,Nam mô A di đà Phật! Cầu mong thế giới bình an! Cầu mong mọi người bình an!,4188067,1001005
1057161163,/them-hai-nguoi-nhap-canh-nhiem-ncov-4188101.html,Cầu mong mọi người bình an! Việt Nam cố lên! Đất nước chiến thắng!,4188101,1003784
1005123456,https://vnexpress.net/an-com-truoc-keng-lam-dem-tan-hon-vo-nghia-4151858.html,Hai vợ chồng bác đúng là hàng hiếm của thời đại 4.0 đấy!,4151858,1004529
1005123456,https://vnexpress.net/thuoc-la-va-covid-4147462.html,Rất mong các anh nghiện thuốc đọc bài này. Cảm ơn GS!,4147462,1003450
1005123456,https://vnexpress.net/pho-quanh-ho-guom-ngap-sau-sau-mua-lon-4147996.html,"Sau mùa mưa lũ năm nay,sẽ có rất nhiều người đổi xe mới.",4147996,1001005
1005123456,https://vnexpress.net/the-can-cuoc-cong-dan-gan-chip-la-gi-4145771.html,Cứ đến tháng lĩnh lương là i-Banking cho vk rồi thì làm sao mà hỏng được thẻ atm!!!,4145771,1004618
1005123456,https://vnexpress.net/the-can-cuoc-cong-dan-gan-chip-la-gi-4145771.html,Từ CMTND đến CCCD và tới sẽ là CCCD điện tử. Vấn đề là đồng bộ hoá tất cả các dữ liệu để công việc của người dân được dễ dàng.,4145771,1004618
1005123456,https://vnexpress.net/cat-do-phim-ve-phan-dan-ba-chua-hoang-4142840.html,"Lưu Trọng Ninh là thế,làm phim truyền hình mà như phim điện ảnh,không làm nhiều phim nhưng phim nào cũng có chiều sâu. Xem phim của Lưu Trọng Ninh là vừa xem vừa ngẫm,không có những tiếng cười nhạt thếch như các phim truyền hình khác.",4142840,1002732
1005123456,https://vnexpress.net/o-tuyen-dau-4142635.html,"Bài viết của a rất chân thực và gây xúc động cho độc giả! Cảm ơn các bác sỹ đang ở tuyến đầu chống dịch,gìn giữ cuộc sống của nhân dân!",4142635,1003450
1005123456,https://vnexpress.net/4-diem-du-lich-noi-tieng-o-quy-nhon-nhin-tu-tren-cao-4131897.html,"Điều thích nhất khi đến Quy Nhơn-Phú Yên,ngoài cảnh đẹp thiên nhiên tuyệt vời,là sự vắng bóng của khách Trung Quốc. Rất thú vị!",4131897,1004636
1002641356,https://vnexpress.net/be-trai-mat-tich-cung-bao-mau-khong-muon-ve-voi-ba-ngoai-4186285.html,"Nếu thương yêu thằng bé thực sự thì mỗi bên hãy tạo điều kiện tốt nhất cho cậu bé đi, Bà ngoại có dấu hiệu bỏ rơi cháu mình rồi còn gì.",4186285,1001007
1002641356,/huong-giang-xin-loi-sau-lum-xum-voi-anti-fan-4186553.html,"Ai cũng có hỉ nộ ái ố, nhưng mình luôn tỉnh thức trong từng hành động. Sẽ bớt gặp tình huống rắc rối.",4186553,1002726
1002641356,https://vnexpress.net/giai-cuu-be-4-tuoi-bi-dong-dat-chon-vui-4-ngay-4186474.html,"Phước lớn mạng lớn, mong cô bé được bình an",4186474,1001002
1002641356,/dat-cuoc-1-trieu-bang-anh-cho-joe-biden-thang-cu-4186016.html,"Ôm trái đắng vì đặt sai cho coi, mình không ủng hộ ai nhưng vẫn tin ông là ông Trump thắng.",4186016,1003185
1002641356,/bai-long-me-tien-biet-nghe-si-anh-hoa-4185851.html,Nguyện cầu hương linh cô vãng sanh Cực Lạc. Nam mô A Di Đà Phật,4185851,1002726
1002641356,https://vnexpress.net/tam-bao-goni-co-the-qua-binh-dinh-phu-yen-4186004.html,"Dù xác xuất rất nhỏ nhưng hy vọng bão tan ngay trên biển, Miền Trung mưa bão nhiều rồi.",4186004,1001005
1002641356,https://vnexpress.net/cac-chi-khong-co-loi-neu-tung-quan-he-voi-ban-trai-4185336.html,"Đúng trên một khía cạch nào đó, còn từ đông sang tây nhiều vụ án ghen tuông chết chóc. Hay thù oán đều từ ngoại tình mà ra cả",4185336,1001014
1002641356,/thu-trang-vo-chong-toi-dung-chung-mat-khau-dien-thoai-4183789.html,"Cô gái này đóng Chuyện Xóm Tui hay nè, đóng như không",4183789,1002753
1002641356,https://vnexpress.net/mien-trung-don-dap-ganh-thien-tai-4185179.html,"Thiên tai hoành hành hàng năm nơi Khúc ruột Miền Trung, xin ôm trọn nơi ấy vào lòng cho những khổ ải qua mau.",4185179,1001005
1005511629,https://vnexpress.net/bao-atsani-suy-yeu-4188232.html,Nghe mà nhẹ cả người!,4188232,1001005
1005511629,https://vnexpress.net/bau-cu-tong-thong-my-ngay-4-11-4186567-tong-thuat.html,Nevada là đủ để Biden thắng rồi. Bang nhỏ có ít phiếu đại cử tri nhưng giữ vai trò quyết định toàn cuộc. Chúc mừng trước cho ông Biden! Chúc ông thành công trong vai trò mới!,4186567,1001002
1005511629,https://vnexpress.net/goni-tro-thanh-bao-manh-nhat-the-gioi-trong-nam-4184852.html,Đã là thảm hoạ thì không thể so sánh nhiều hay ít được.,4184852,1001002
1005511629,https://vnexpress.net/quan-doi-philippines-truc-chien-sieu-bao-goni-4185007.html,Cầu mong cho bão đừng vào Việt Nam!,4185007,1001002
1005511629,https://vnexpress.net/do-bep-gas-mini-cu-thanh-pc-4087413.html,"Ý tưởng thì lạ nhưng không ăn toàn, dễ bị điện giật vì bếp ga thì đa phần vỏ bằng kim loại mà. Thôi thà giống mọi người cho lành chứ khác người quá có ngày mang hoạ vào thân.",4087413,1002661
1005511629,https://vnexpress.net/nguoi-trung-quoc-dieu-hanh-app-cho-vay-lai-90-moi-thang-4087545.html,Khốn nạn. Phải xử thật mạnh tay với bọn này,4087545,1001007
1005511629,http://vnexpress.net/tin-tuc/thoi-su/bot-tuyet-noi-trang-kenh-o-sai-gon-3585274.html,băng bắc cực tan trôi tới thành phố rồi,3585274,1001005
1061601392,/cach-lam-cha-ca-la-vong-dung-chuan-ha-thanh-4188470.html,Ôi món ngon khó quên mỗi lần tôi đến Hà Nội.,4188470,1003806
1061601392,/hue-sap-co-nha-may-dien-khi-lng-6-ty-usd-4188684.html,Cảm ơn nhà đầu tư đã chọn Huế làm nơi khởi nguồn.,4188684,1003184
1061601392,https://vnexpress.net/trum-cho-vay-nang-lai-o-thai-binh-bi-bat-4188666.html,Nỗi buồn Thái Bình quê tôi.,4188666,1001007
1061601392,https://vnexpress.net/thi-the-phu-nu-o-chung-cu-4188726.html,Khủng khiếp&nbsp;,4188726,1001007
1061601392,https://vnexpress.net/bien-dong-xuat-hien-ap-thap-nhiet-doi-4188679.html,Nỗi buồn thiên tai.,4188679,1001005
1061601392,https://vnexpress.net/canh-sat-truy-lung-8-nguoi-lien-quan-vu-buon-lau-51-kg-vang-4188652.html,Nhân danh từ thiện thật là xấu xa.,4188652,1001007
1061601392,https://vnexpress.net/nguoi-dan-ong-nhay-xuong-dong-lu-cuu-nguoi-4188656.html,"Cảm ơn anh người trai đất Quảng Trị, đã dũng cảm cứu người.<br/>Chúc anh sức khỏe nhé.",4188656,1001005
1061601392,https://vnexpress.net/chang-trai-huong-noi-don-gian-4185019.html,Em 44 rồi.. ôi tiếc điều hướng nội và giản đơn của chàng trai Băm Bốn này quá đi thôi.,4185019,1004257
1061601392,https://vnexpress.net/co-gai-dang-yeu-tim-ban-dong-hanh-4187942.html,Đồng hành và đồng cảm cùng cô gái suốt 365 ngày luôn nhé.,4187942,1004257
1061601392,https://vnexpress.net/anh-dung-o-xa-em-nhe-4187938.html,Thích em cô gái có đôi mắt to tròn này lắm rồi nè.,4187938,1004257
1046493285,https://vnexpress.net/biden-tuyen-bo-chien-thang-cam-ket-han-gan-linh-hon-nuoc-my-4188538-tong-thuat.html,"32 năm giấc mơ nay đã thành sự thật, chúc mừng tân Tổng thống Biden!",4188538,1001002
1046493285,https://vnexpress.net/trump-bau-cu-con-lau-moi-cham-dut-4188474.html,"Thôi đi Trump, người dân Mỹ họ rất sáng suốt để lựa chọn vị Tổng thống của họ. Chúc mừng tân Tổng thống Biden!",4188474,1001002
1046493285,https://vnexpress.net/tau-hang-chim-tren-bien-4188304.html,"Nếu thuyền trường đeo phao cứu sinh thì chắc chắn vẫn còn sống, đang trôi nổi ở đâu đấy thôi, khẩn trương mở rộng địa bàn tìm kiếm, sẽ tìm được.",4188304,1001005
1046493285,https://vnexpress.net/bao-manh-cap-10-gan-bien-dong-4188067.html,Ghét cái không khí lạnh khô quá thôi.,4188067,1001005
1046493285,https://vnexpress.net/san-bay-cam-ranh-ngung-phat-loa-4187783.html,"Ngừng phát loa thông báo quá chính xác luôn, ai đi thì họ sẽ tìm đến nơi có màn hình điện tử chứ thực ra đâu có chú ý tới tiếng loa.",4187783,1003459
1046493285,/tin-tuc/thoi-su/ngu-dan-chim-tau-ke-giay-phut-sinh-tu-tren-bien-4186490.html,Đúng là điều kỳ diệu đã đến với họ!,4186490,1003004
1046493285,https://vnexpress.net/tra-vinh-ton-100-000-tan-rac-4185907.html,"Giờ đi ra đường những nơi xa khu dân cư, rác vứt đầy, thôi thì không thiếu thứ gì. Mùi sú uế nồng nặc, nhiều quá lại thấy họ đốt, khói bay mịt mù, chẳng lẽ cách xử lý rác thải như vậy sao?",4185907,1001005
1046493285,/hazard-ghi-ban-cho-real-sau-392-ngay-4185158.html,"Real lại vô địch thôi, khoảng cách với đại kình địch Barca đang xa dần, ai đồng quan điểm thì giơ tay nhé.",4185158,1002582
1046493285,https://vnexpress.net/hon-hai-ngay-co-lap-giua-rung-cua-cong-nhan-thuy-dien-dak-mi-2-4185029.html,Sau này tất cả những người đã sống ở những khu vực bị sạt lở cần phải chuyển đi nơi khác để tránh những hiểm họa về sau.,4185029,1001005
1046493285,https://vnexpress.net/chim-hai-tau-ca-26-ngu-dan-mat-tich-4183077.html,3 người ôm mảnh gỗ mấy ngày trên biển được cứu sống đó,4183077,1001005
1046493285,/nam-dinh-tru-lai-v-league-4185060-tong-thuat.html,"Nam Định cần 3 điểm, cố lên!",4185060,1003001
1046493285,https://vnexpress.net/nha-dan-tan-hoang-sau-bao-molave-4183460.html,THƯƠNG VỀ MIỀN TRUNG!<br/>Nắng thì như cháy thịt da<br/>Ruộng đồng khô hạn hoa màu xác xơ<br/>Nhưng khi mưa bão tràn về<br/>Làng quê thành thị tứ bề ngập sâu<br/>Khó khăn làm bạc mái đầu<br/>Đêm không ngủ được mưu cầu tương lai<br/>Ướt mi nước mắt chảy dài<br/>Miền Trung sao lại bão hoài bão ơi?<br/>Từ nay chấm dứt đi thôi<br/>Để thuyên tung lưới ngoài khơi cá nhiều<br/>Cuộc sống vui vẻ sớm chiều<br/>Không còn lo bão là điều ước mong!,4183460,1001005
1013764606,https://vnexpress.net/biden-dac-cu-tong-thong-my-4188414-tong-thuat.html,Chúc mừng ông,4188414,1001002
1013764606,/klopp-man-city-kho-choi-nhat-the-gioi-4188227.html,Ông Kloop này thì ai ông ấy chẳng khen!,4188227,1002580
1013764606,https://vnexpress.net/tau-hang-chim-tren-bien-4188304.html,Tại sao những cái tầu to như thế này mà lại không có thuyền dự phòng nhỉ?,4188304,1001005
1013764606,/koeman-toi-khong-thay-messi-di-bo-4188163.html,Bằng mặt nhưng không bằng lòng! Ông không nói vậy thì chủ tịch thải loại ông ngay!,4188163,1002582
1013764606,https://vnexpress.net/cho-husky-noi-doa-khi-duoc-chu-to-chuc-sinh-nhat-4188003.html,Nếu đây không phải là con chó. Mà là con của người đàn ông này mà hất tung chiếc bánh sn như thế thì không biết người đàn ông đó sẽ như thế nào nhỉ ?,4188003,1001011
1013764606,https://vnexpress.net/nhay-khoi-mai-nha-vi-de-dau-tran-lay-to-ong-4187309.html,Ông cầm tổ ong chạy đâu rồi?,4187309,1001011
1013764606,https://vnexpress.net/10-dai-hoc-danh-tieng-nhat-the-gioi-nam-2020-4187740.html,Học giỏi là một phần. Phần còn lại là phải rất rất nhiều tiền.,4187740,1003497
1013764606,/man-utd-chi-con-3-co-hoi-vo-dich-champions-league-4187730.html,"Còn nước còn tát, cố lên Rùa!",4187730,1002575
1013764606,https://vnexpress.net/cha-co-duoc-tu-con-khong-4187546.html,Đó là ba cái hoạ của con người. Tuổi già và cái chết họa không ai tránh được. Nhưng con hư thì có thể. Bởi vậy ngoài sức khỏe thì con người ta luôn mong muốn con cái ngoan ngoãn.,4187546,1001007
1013764606,/video-dem-so-cua-tiktoker-viet-thanh-tam-diem-mang-xa-hoi-my-4187615.html,Cái gì tự nhiên thì cũng đẹp và ý nghĩa hơn.,4187615,1004650
1013764606,https://vnexpress.net/cha-co-duoc-tu-con-khong-4187546.html,"Ba điều bất hạnh nhất của đời người là: tuổi già, cái chết và con hư. Không ít người cầu mong luôn có sức khỏe tốt và con cái ngoan ngoãn.",4187546,1001007
1013764606,/o-hara-pochettino-co-the-nang-tam-man-utd-4187633.html,Nếu mà ông về Mu thì tôi và ông chia tay nhé !,4187633,1002580
1013764606,/be-5-tuoi-mong-pha-ky-luc-the-gioi-ve-nhao-lon-4187454.html,Chúc con thành công.,4187454,1003819
1002641356,/nghe-si-anh-hoa-qua-doi-4185328.html,"Con thích vai diễn của cô trong Đất Phương Nam, cầu nguyện cô được đoàn tụ với chồng con và an vui miền Tịnh Cảnh.",4185328,1002726
1061601392,https://vnexpress.net/nu-800-trieu-nen-mua-xe-gi-4187800.html,Mua wave hoặc sh mod nhé.,4187800,1004243
1061601392,https://vnexpress.net/bao-atsani-suy-yeu-4188232.html,"Cảm ơn độ yếu của bão, để mọi người bớt khổ.",4188232,1001005
1046493285,https://vnexpress.net/chim-hai-tau-ca-26-ngu-dan-mat-tich-4183077.html,"Giờ chỉ hy vọng các thuyền viên ôm được phao cứu sinh hoặc những mảnh vỡ của tàu, trôi dạt theo sóng vào bờ được thôi, mong có một phép màu kỳ diệu đến với họ!",4183077,1001005
1046493285,/cuu-trong-tai-la-liga-real-khong-dang-huong-penalty-4181757.html,Thơ hay.,4181757,1002582
1046493285,/koeman-var-chi-quyet-dinh-bat-loi-cho-barca-4181740.html,"Thua 1-2 hay 1-3 cũng không khác nhau, y hệt như câu nói của Mou. Sáng nay dậy sớm xem ba bàn thắng của Real 10 lần không thấy chán, Real thật tuyệt vời!",4181740,1002582
1046493285,/real-thang-barca-3-1-4181655-tong-thuat.html,"Quả pen nghoảnh đi không dám nhìn, hồi hộp quá, bàn thắng thứ 3 cảm xúc dâng trào, chúc mừng Real!",4181655,1003001
1046493285,/tin-tuc/nhip-song/chang-tay-phai-long-co-gai-viet-tu-lan-gap-dau-tien-4181087.html,&nbsp;Hạnh phúc mãi nha.,4181087,1004075
1046493285,https://vnexpress.net/chu-tich-hoi-chu-thap-do-vn-thuy-tien-co-quyen-keu-goi-cuu-tro-4181040.html,"Thủy Tiên sẽ trao quà cho từng người, không qua khâu trung gian, như vậy rất là hay đấy bạn thơ nhỉ?",4181040,1001005
1046493285,https://vnexpress.net/quy-hy-vong-vnexpress-tang-hon-2-500-phan-qua-cho-dong-bao-vung-lu-4180784.html,"Dù còn rất nhiều khó khăn sau khi lũ rút, nhưng nhìn những nụ cưới tươi của mọi người khi họ được trao phần quà từ Quỹ Hy vọng thật đáng quý từ tình cảm của Độc giả khắp mọi miền đất nước và cả ở nước ngoài, cùng chung tay hướng về Miền Trung yêu thương!",4180784,1001005
1046493285,https://vnexpress.net/loi-khai-trai-nguoc-trong-vu-an-nang-diem-thi-o-hoa-binh-4180583.html,"Những năm trước kia không làm mất công bằng cho học sinh, nhưng chỉ một lần thôi là đã bị vào tù, đừng quanh co nữa.",4180583,1001007
1013764606,/messi-than-nhien-nhin-cau-thu-dynamo-di-bong-4187343.html,Nếu có giải thưởng cho cầu thủ đi bộ bền nhất thì Pogba và Si lùn chiếm hết!,4187343,1002575
1013764606,https://vnexpress.net/co-dau-ngung-khoc-khi-bi-bat-vao-rua-bat-4187507.html,Bố bao giờ cũng thương con gái nhất!,4187507,1001011
1013764606,https://vnexpress.net/co-gai-chay-xe-kieu-zic-zac-tren-pho-4187285.html,Đang fê zồi!,4187285,1001011
1013764606,https://vnexpress.net/chu-xe-bien-so-49-53-duoc-nhieu-nguoi-khuyen-mai-4186794.html,"Ở Bắc Giang tôi cũng có biển mới tinh 34953, chủ xe là nữ&nbsp;",4186794,1001006
1013764606,/van-persie-man-utd-di-nguoc-quy-tac-thoi-sir-alex-4187137.html,Cái ảnh chụp 3 ông Mu đứng ở một hàng bảo vệ nhau !,4187137,1002575
1013764606,https://vnexpress.net/ten-trom-doi-co-gianh-lai-tien-cua-minh-4186181.html,"Nếu đây thự sự là trộm tôi sẽ cho cậu này thêm tiền. Vì tôi thấy tên trộm này rất lành. Nếu là tên trộm khác không biết bà chủ còn mạng để đôi co, đòi lại đồ với nó nữa không?",4186181,1001011
1013764606,/co-gai-22-tuoi-dong-nguoi-tinh-trinh-cong-son-4186383.html,Ôi nhạc Trịnh đã làm tốn bao nước mắt của các chàng trai cô gái!,4186383,1002733
1004770025,/juventus-danh-roi-chien-thang-o-phut-cuoi-4188739.html,Về vấn đề này phải nơi là bacca lúc có Xavi Iniesta và lúc không có như thế nào? Thế giới đang phát triển từng ngày. Các đối thủ họ cũng manh lên trong khi juve các nhân tố chính đã già đi. Còn laliga thì khác. Các đội đều yếu đi kể cả Bacca nhưng họ yếu là cùng yếu ko giống seria juve trụ cột đã già và các đối thủ thì mạnh lên.,4188739,1002581
1004770025,https://vnexpress.net/cap-doi-quy-du-o-canada-4188136.html,Nhiều bộ phim mỹ tưởng là không có thật nhưng hoá ra đều dựa trên những câu chuyện thật.,4188136,1003426
1004770025,/messi-ghi-cu-dup-du-da-du-bi-4188476.html,Đối thủ đá có 10 người thôi. Thắng kiểu này Người ta còn thấy xấu hổ ấy .,4188476,1002582
1004770025,/man-utd-thang-nguoc-trong-vong-7-phut-4188454.html,Hôm nay rảnh ra cafe ngồi chơi xem trận MU đá. Ngồi bên cạnh có 1 thanh niên áng chừng 30 tuổi fan Mu hễ cứ cầu thủ Everton phạm lỗi là ổng đòi rút thẻ vàng. Hễ cứ ngã trong vòng cấm là đòi phạt pen. Rồi cậu 1 mình đánh hết 5 chai bia vừa xem vừa lẩm bẩm đúng là đường dài mới biết ngưạ hay. Mình fan Liverpool nghệ cũng thấy buồn cười mà ko dám lên tiếng.,4188454,1002580
1004770025,https://vnexpress.net/tau-hang-chim-tren-bien-4188304.html,Hy vọng thuyền trưởng được cứu sống.,4188304,1001005
1004770025,/koeman-toi-khong-thay-messi-di-bo-4188163.html,Messi giờ giống như 1 học sinh con nhà giàu lưu ban ở lớp 1 quá lâu nên thành đại ca vì to đầu nhất khi các bạn cùng lớp đã học lớp 8 rồi.nhưng fan si thì gọi đó là giỏi nên mới đá đc chủ tịch và HLV.,4188163,1002582
1004770025,/koeman-toi-khong-thay-messi-di-bo-4188163.html,Ừm. Tưởng koeman thế nào? Đã nhìn thấy kết quả của bacca năm nay. Vẫn giông năm ngoái thôi. Nhưng năm nay ko còn 82 nữa vì lôi đc Coutinho về rồi. Tầm 61 thì khả năng có nhiều.,4188163,1002582
1004770025,/man-utd-chi-con-3-co-hoi-vo-dich-champions-league-4187730.html,Biết đặc sản juve là gì thì hãy nói tiếp. Còn đã biết đặc sản của juve có những ai làm nên và giờ còn ai thì hãy tính. Xem bóng phải hiểu .cuồng thì gọi là trẻ trâu.,4187730,1002575
